{
  "schema_version": 1,
  "task_id": "S05",
  "stage": "CODE",
  "run_id": "s05-runtime-full-close-final-adversarial-review-20260914",
  "actual_model": "gpt-5",
  "implementer_run_id": "runtime-full-close-correction-20260914",
  "independent_context": true,
  "verdict": "ACCEPT",
  "reviewed_fingerprint": "sha256:e373bc17c70cbfb7f1e9408ee64b915470f3da26060706855257af23c561ccd9",
  "reviewed_diff_artifact": null,
  "checks_run": [
    {
      "id": "branch-and-fingerprint",
      "status": "PASS",
      "command": "python docs/MoonWaker/HARDENING/tools/packet.py branch-check --repo . && python docs/MoonWaker/HARDENING/tools/packet.py fingerprint --repo .",
      "observed": "Prepared branch codex/session-hardening at e049e9f8394094f3409b45f6bb300234cb7b3382; corrected candidate fingerprint sha256:e373bc17c70cbfb7f1e9408ee64b915470f3da26060706855257af23c561ccd9 matches the final worker report. The earlier handoff fingerprint sha256:f85c11183fd56e800d27a702d9bbb54665f428279b5270ccfbcfff7790b33f2a was superseded by reviewed corrections."
    },
    {
      "id": "scoped-file-hashes",
      "status": "PASS",
      "observed": {
        "app/src/main/java/com/limelight/Game.java": "sha256:d65438d34d5e255095c390fb61b7ec59a4a676f1b5e7bd0c36a2bc60a6049bb1",
        "app/src/test/java/com/limelight/GameAutoWarmUpContractTest.java": "sha256:7f74cbd341dbe5ff63961f78d3db2b37d78b40d4f8ed7572e461bc5d04c7aee6",
        "host-services/gateway/wakeplay_gateway.py": "sha256:91e921521f2fb72aca99d10202baefaf13d8d7de66e5b50159a635cbf8a7b60e",
        "host-services/gateway/test_child_time_control.py": "sha256:0af603dfcd54705ba9254a385932115c481f3e6413384d404a6369360f6caec7"
      }
    },
    {
      "id": "gateway-targeted-adversarial",
      "status": "PASS",
      "command": "python -m unittest <16 explicit ChildTimeControlTest race, adoption, restart, orphan and negative-fence tests>",
      "observed": "16/16 PASS in 0.844s, including the original required 14 plus missing-effect-hash rejection and forced user_terminated orphan replay."
    },
    {
      "id": "gateway-direct-related",
      "status": "PASS",
      "command": "python -m unittest test_child_time_contract test_child_time_control test_child_sessions_http test_session_recovery test_control_operations",
      "observed": "144/144 PASS in 23.162s."
    },
    {
      "id": "gateway-full-discovery",
      "status": "PASS",
      "command": "python -m unittest discover -p \"test_*.py\"",
      "observed": "310/310 PASS in 40.014s."
    },
    {
      "id": "gateway-python-compile",
      "status": "PASS",
      "command": "python -m py_compile wakeplay_gateway.py test_child_time_control.py",
      "observed": "PASS."
    },
    {
      "id": "android-targeted",
      "status": "PASS",
      "command": ".\\gradlew.bat testNonRootDebugUnitTest --tests com.limelight.GameAutoWarmUpContractTest --offline --no-daemon --console=plain",
      "observed": "BUILD SUCCESSFUL after correction of the source-order assertion; GameAutoWarmUpContractTest passed."
    },
    {
      "id": "android-full-nonroot-unit",
      "status": "PASS",
      "command": ".\\gradlew.bat testNonRootDebugUnitTest --offline --no-daemon --console=plain",
      "observed": "BUILD SUCCESSFUL; 114 XML suites, 1114 tests, 0 failures, 0 errors, 0 skipped."
    },
    {
      "id": "android-debug-release-build",
      "status": "PASS",
      "command": ".\\gradlew.bat assembleNonRootDebug assembleNonRootRelease --offline --no-daemon --console=plain",
      "observed": "Independent JDK17/offline build completed with exit code 0: BUILD SUCCESSFUL in 1m45s; 99 tasks, 31 executed."
    },
    {
      "id": "scoped-diff-check",
      "status": "PASS",
      "command": "git diff --check -- app/src/main/java/com/limelight/Game.java app/src/test/java/com/limelight/GameAutoWarmUpContractTest.java host-services/gateway/wakeplay_gateway.py host-services/gateway/test_child_time_control.py",
      "observed": "PASS; only line-ending normalization warnings were emitted."
    },
    {
      "id": "contract-wiring-review",
      "status": "PASS",
      "observed": [
        "Terminal reservation and nonterminal release share the existing Gateway lock; every listed nonterminal release remains unable to erase the exact session once terminal ownership is reserved.",
        "A tokenless launch_pending session may adopt only the exact game, token and PID already carried by its matching child-terminal permit; the adopted identity is checkpointed before the stop effect.",
        "Uncertain retry and restart reuse child-terminal:<session_id>, the same generation and actor epoch, the same process identity and a required non-empty exact effect hash.",
        "The installed active_session=null, uncertain child-terminal generation 166, retained stream generation 165 shape is repairable only through the exact persisted orphan path; stale, wrong, newer, replacement and incomplete evidence remains fail-closed.",
        "Android restarts the existing ChildSessionLifecycle only after its retainedSwitch marker has been cleared, including the recovery completion path.",
        "Whole-session reasons continue through child-terminal and streamer close; game_stopped alone remains the game-only provider transition path.",
        "No new child-only stream lifecycle, durable state store or ownership abstraction was introduced."
      ]
    },
    {
      "id": "ponytail-complexity-review",
      "status": "PASS",
      "observed": "No removable dependency, speculative owner or dead recovery path was found in the reviewed correction. The long orphan-recovery function is explicit because each branch represents a required fail-closed fence; extracting or collapsing those checks would not reduce the safety-critical state space. Lean already for this bounded correction; net: 0 lines safely removable."
    }
  ],
  "findings": [],
  "unverified_claims": [
    "No Gateway installation, service restart, Android APK installation, physical Windows process observation or Android TV stream scenario was performed.",
    "The reported installed generation-166 orphan was not mutated or re-read live; compatibility is established from the supplied installed-state projection and deterministic production-wiring tests."
  ],
  "accepted_task_scope": "The corrected Android and Gateway source implements the S05 retained-switch/full-close recovery contract: common child monitoring resumes after marker clear, exact tokenless identity is durably adopted, terminal cleanup wins after reservation, exact uncertain operations survive retry/restart, the supplied installed orphan shape is recoverable, and unsafe identity/evidence variants fail closed without degrading full quit to game-only cleanup.",
  "pending_integrated_or_device_gates": [
    "S05-LAB-CHILD-FULL-CLOSE-AFTER-RETAINED-SWITCH-PROFILE-1",
    "S05-LAB-CHILD-FULL-CLOSE-AFTER-RETAINED-SWITCH-PROFILE-2",
    "S05-LAB-CHILD-NEXT-START-AFTER-FULL-CLOSE"
  ],
  "next_action": "Preserve fingerprint sha256:e373bc17c70cbfb7f1e9408ee64b915470f3da26060706855257af23c561ccd9, then install the already built candidate only under separate authorization and execute the three bound Windows/TV checks before advancing the checkpoint.",
  "behavioral_verdict": "ACCEPT_CODE_DEVICE_PENDING",
  "architecture_verdict": "ACCEPT",
  "reviewed_plan_sha256": "sha256:bba1c73b496d6e6946755a49ae397ca93876ee814f54cc8e7f35481fdf6762ef",
  "whole_slice_independently_usable": true
}
