{
  "schema_version": 1,
  "task_id": "S00",
  "stage": "CODE",
  "run_id": "S00-final-review-20260909T084527Z",
  "actual_model": "gpt-5.6-sol",
  "implementer_run_id": "S00-worker-corrections-20260909T0829Z",
  "independent_context": true,
  "verdict": "ACCEPT",
  "reviewed_fingerprint": "sha256:db6880c0f0597149222d926db820b8438b2ca836d046cdb8c86dac8aacc7a387",
  "reviewed_diff_artifact": "runs/S00/owned-changes.md",
  "checks_run": [
    {
      "id": "REVIEW-BRANCH-GUARD",
      "status": "PASS",
      "command": "python docs/MoonWaker/HARDENING/tools/packet.py branch-check --repo .",
      "observed": "PREPARED_WORK_BRANCH_VERIFIED on codex/session-hardening at 00366fd92a1f283bf3aa04171ed3455ce62897ac; recorded base and fetched tip are the same commit. This was a local consistency check, not a fetch or refork."
    },
    {
      "id": "REVIEW-SOURCE-FINGERPRINT",
      "status": "PASS",
      "command": "python docs/MoonWaker/HARDENING/tools/packet.py fingerprint --repo .",
      "observed": "sha256:db6880c0f0597149222d926db820b8438b2ca836d046cdb8c86dac8aacc7a387, exactly matching implementation, command plan and gate before/after bindings."
    },
    {
      "id": "REVIEW-PACKET-METADATA",
      "status": "PASS",
      "command": "python docs/MoonWaker/HARDENING/tools/packet.py validate",
      "observed": "VALID_PACKET_METADATA: 11 tasks, 11 findings, 46 scenarios and 28 invariants."
    },
    {
      "id": "REVIEW-PACKET-TOOLS",
      "status": "PASS",
      "command": "python -m unittest discover -s docs/MoonWaker/HARDENING/tools -p test*.py",
      "observed": "70 tests ran independently in 27.193 seconds; zero failures and zero skips. The result is repeatable at the current live handoff state."
    },
    {
      "id": "REVIEW-PLAN-BINDINGS",
      "status": "PASS",
      "command": "Recompute SHA-256 of checkpoint-plan.json, local-pipeline-v2.json and corrected-local-run-01/gate.json",
      "observed": "Checkpoint plan is sha256:443ef6d5eb137a921b4fbf15442da400a803a2208cc2642a3b9c13a28a1273b9; command plan is sha256:9f3d3a8c9786d6411373b8e6066909ca82d1329235831bd2d42a6ab9f52ed4ec; original runner gate is sha256:ae33483eb22494e9fde10b9b796e8f1f76919385eef9a97668349f649710258f. All match the correction record."
    },
    {
      "id": "REVIEW-FRESH-LOCAL-GATE",
      "status": "PASS",
      "command": "Read corrected-local-run-01/gate.json and recompute every referenced log hash",
      "observed": "One bound run contains all 18 required checks, all PASS at exit 0. All 18 log hashes match. TEST counts are packet 70, F01-F07 30/52/50/5/3/59/12, Android 1011, Gateway 191, Bridge 248, Broker 15 and runner contract 22; every test row has nonzero execution with zero failures/skips. Debug/release builds and host package also passed."
    },
    {
      "id": "REVIEW-BUILD-ARTIFACTS",
      "status": "PASS",
      "command": "Recompute sizes and SHA-256 for the debug APK, unsigned release APK and corrected host installer",
      "observed": "All three files match implementation.json exactly: debug APK sha256:3b92ef83..., release APK sha256:605e9bee..., host installer sha256:8faf47a6.... They are local validation outputs and were not installed or deployed."
    },
    {
      "id": "REVIEW-ARCHIVE-REJECTION",
      "status": "PASS",
      "command": "Read run_checks.py and its archive regression; verify recorded packet-tool hashes and historical archive hashes",
      "observed": "run_checks.py requires a .json plan before reading plan bytes or creating output. The regression mocks Path.read_text and proves unsafe.executed.txt returns failure without read or output. All four packet-tool hashes and all three preserved archive hashes match corrections.json. No historical plan was executed by this reviewer."
    },
    {
      "id": "REVIEW-STATE-INDEPENDENT-FIXTURES",
      "status": "PASS",
      "command": "Read test_packet.py fixture setup and independently rerun all packet-tool tests",
      "observed": "PacketTests.setUp resets every synthetic task to NOT_STARTED and clears implementation, design-review and review reports. Tests no longer inherit live STATE handoff fields; the independent 70-test pass confirms the correction."
    },
    {
      "id": "REVIEW-TRACKED-DIFF-AND-WIRING",
      "status": "PASS",
      "command": "git status --short; git diff --check; inspect actual tracked/test-tool changes and production call paths",
      "observed": "The only tracked source change is host-services/control/Test-MoonWakerHostControl.ps1; it is test-only. Packet artifacts/tools remain under the fresh untracked hardening packet. No Android, Gateway, Bridge, Broker, installer production behavior, dependency, wire schema or packaging owner changed. git diff --check passed."
    },
    {
      "id": "REVIEW-HOST-ISOLATION",
      "status": "PASS",
      "command": "Read-only inspection of Build-HostServices.ps1, Test-MoonWakerHostControl.ps1, Invoke-MoonWakerHostControl.ps1 and related self-tests",
      "observed": "The obsolete copied production stopper is removed. The generated test stopper rejects any directory other than its exact temporary PSScriptRoot before effects, reads only its temp runtime identity, reopens the captured fixture PID, compares its captured creation timestamp, and stops only that PID. The uncorrelated case must leave the fixture listener running. Service cmdlet canaries throw, fixed legacy roots are not reached, and no comparable installed-service mutation is present in the other invoked package self-tests. This reviewer did not rerun the package or mutate a service."
    },
    {
      "id": "REVIEW-SERVICE-EVIDENCE",
      "status": "PASS",
      "command": "Verify the hash-bound corrected host log and incident/recovery chronology without a live service query",
      "observed": "The hash-matched host log records GATEWAY_SERVICE_BEFORE=Running and GATEWAY_SERVICE_AFTER=Running. The fixture code has no installed-service control path and the gate records service_control_performed=false. The prior test reached installed-service-capable code, but the user confirmed Gateway was already Stopped beforehand; no prior state transition is observed or attributed."
    },
    {
      "id": "REVIEW-ARCHITECTURE-AND-BASELINE",
      "status": "PASS",
      "command": "Inspect baseline.json, architecture.json, implementation.json, compatibility.md, recovery.md and cited production owners/callers",
      "observed": "H01-H11 remain supported static findings at the actual head, not runtime reproductions or fixes. Game, ConsoleActivity, Gateway and Provider Bridge responsibilities identify state, effects, callers, lifetimes, packaging and seams. S00 introduces no duplicate production authority; its only ownership correction removes production service/legacy-root responsibility from the Host Control fixture."
    },
    {
      "id": "T43",
      "status": "PASS",
      "command": "Independent aggregate review of the complete S00 checkpoint",
      "observed": "Accepted only as the whole S00 aggregate: exact source and plan bindings, all 18 mandatory local gates, baseline/responsibility artifacts, compatibility/recovery, corrected safety boundary and this independent review pass. The 22 S00-RUNNER-CONTRACT tests are internal runner evidence and are not themselves T43."
    }
  ],
  "findings": [],
  "unverified_claims": [
    "Physical F01-F07 Android TV/Windows/native flows remain NOT_RUN. S00 requires no device checks, and this acceptance is not MoonWaker E2E evidence.",
    "H01-H11 are statically revalidated inherited findings; they were not physically reproduced or fixed in S00.",
    "D01 retention policy, D04 generation-scoped remote stream termination and D05 authorized disposable device/profile mapping remain pending for their dependent later slices.",
    "The corrected service before/after evidence is the hash-bound worker log; this reviewer intentionally did not query or control MoonWakerGateway after the run."
  ],
  "accepted_task_scope": "S00 setup-only slice: preserved branch/base binding; actual baseline and H01-H11 responsibility/caller maps; repeatable local 18-check build/test pipeline; archive-path guard and state-independent packet fixtures; test-only Host Control isolation; compatibility, recovery and incident evidence. No gameplay change, deployment, installation or device/E2E acceptance.",
  "pending_integrated_or_device_gates": [
    "No mandatory integrated or device gate remains for S00.",
    "Physical F01-F07 and task-specific native/Windows/TV evidence remain mandatory only when required by later affected checkpoint plans; missing mandatory later evidence must yield CODE_VERIFIED_DEVICE_PENDING."
  ],
  "next_action": "Accept S00 and permit dependency progression using the existing codex/session-hardening branch and recorded base. Preserve the exact reviewed fingerprint/plan binding and the historical incident evidence; any source or plan change requires fresh applicable checks and review.",
  "behavioral_verdict": "ACCEPT",
  "architecture_verdict": "ACCEPT",
  "reviewed_plan_sha256": "sha256:443ef6d5eb137a921b4fbf15442da400a803a2208cc2642a3b9c13a28a1273b9",
  "whole_slice_independently_usable": true
}
